,Alcohol,Appellation,Bottle Size,Category,Country,Date Published,Description,Designation,Importer,Name,Price,Province,Rating,Region,Reviewer,Reviewer Twitter Handle,Subregion,User Avg Rating,Variety,Vintage,Winery
0,14%,"Rioja, Northern Spain, Spain",750 ml,Red, Spain,5/1/2023,"
                      Aromas of brambly fruits of the wood, dark chocolate and violet talc pave the way for flavors of cherry, cassis, mocha, dried hillside herbs and a touch of lavender. Sleek tannins and a note of coffee bean make for a satisfying finish.                      Mike DeSimone ",Monte Real Gran Reserva,Bodegas Riojanas,"
Bodegas Riojanas 2016 Monte Real Gran Reserva  (Rioja) ",$48, Northern Spain,93,Rioja,Mike DeSimone,,null,Not rated yet [Add Your Review],Tempranillo,2016,Bodegas Riojanas
1,14.5%,"Russian River Valley, Sonoma, California, US",750 ml,Red, US,5/1/2023,"
                      Offering vivid strawberries in the nose and full, dusky black fruits on the palate, this full-bodied and appropriately tannic wine craves a grilled lamb chop or eggplant parmigiana.                      Jim Gordon ",Don Miguel Vineyard Estate Grown,null,"
Marimar 2018 Don Miguel Vineyard Estate Grown Tempranillo (Russian River Valley) ",$57, California,91, Sonoma,Jim Gordon,,Russian River Valley,Not rated yet [Add Your Review],Tempranillo,2018,Marimar
2,14.5%,"Rioja, Northern Spain, Spain",750 ml,Red, Spain,4/1/2023,"
                      This dark-ruby-colored wine has aromas of brambly fruits of the wood, with touches of cedar and violet. Notes of clove and eucalyptus are joined by exquisite flavors of cherry, cassis, dark chocolate and orange zest. Downy tannins carry on into an enduring finish. Drink now through 2044.                      Mike DeSimone ",Aro,Jorge Ordóñez Selections,"
Muga 2019 Aro  (Rioja)Cellar Selection ",$400, Northern Spain,97,Rioja,Mike DeSimone,,null,Not rated yet [Add Your Review],"Tempranillo Blend, Tempranillo",2019,Muga
3,14%,"Rioja, Northern Spain, Spain",750 ml,Red, Spain,4/1/2023,"
                      Aromas of dark plum, cassis and herbes de Provence pave the way for flavors of black cherry, purple fig, cocoa powder, espresso bean and violet, with touch of black-olive paste. Durable tannins and brilliant acidity play on the palate and stay for a while. Drink now through 2039.                      Mike DeSimone ",El Tiznado,Jorge Ordóñez Selections,"
Cuenta Viñas 2019 El Tiznado  (Rioja)Cellar Selection ",$350, Northern Spain,96,Rioja,Mike DeSimone,,null,Not rated yet [Add Your Review],Tempranillo,2019,Cuenta Viñas
4,14.5%,"Rioja, Northern Spain, Spain",750 ml,Red, Spain,4/1/2023,"
                      This wine has a nose of black currant, coffee bean and butterscotch. It is smooth in the mouth, with satiny tannins and flavors of black cherry, raspberry, milk chocolate, anisette and lavender that evaporate into a floral-strewn finish.                      Mike DeSimone ",La Nieta,Fine Estates From Spain,"
Viñedos de Paganos 2019 La Nieta  (Rioja) ",$190, Northern Spain,96,Rioja,Mike DeSimone,,null,Not rated yet [Add Your Review],Tempranillo,2019,Viñedos de Paganos
5,14.5%,"Rioja, Northern Spain, Spain",750 ml,Red, Spain,4/1/2023,"
                      Deep-violet in the glass, this wine has a bouquet of slightly brambly fruits of the wood and a hint of lavender. Dark chocolate and caramel open on the palate, joined by plush tannins and flavors of pomegranate, cherry and orange zest that wend their way towards a lingering finish.                      Mike DeSimone ",Real de Asúa,Arano LLC,"
CVNE 2018 Real de Asúa  (Rioja) ",$125, Northern Spain,94,Rioja,Mike DeSimone,,null,Not rated yet [Add Your Review],"Tempranillo Blend, Tempranillo",2018,CVNE
